{
  "id": "FB-0032",
  "createdAt": "2026-10-29T13:03:52Z",
  "reportedBy": "claude-agent",
  "application": {
    "id": "caissatrainer",
    "route": "Education hub (desktop 1440)"
  },
  "guidanceVersion": "0.1.0",
  "component": "The same verb button repeated per category (four Create New X buttons)",
  "screenshots": [
    {
      "file": "before-_education-1440.png"
    },
    {
      "file": "_education-1440.png"
    }
  ],
  "explanation": "CaissaTrainer Phase 2 (education.md E6, E7). Observed: four Create New X secondary buttons that differ by one noun, and two green library buttons. Fix: one New menu with the category chosen inside, one whole card link per library. P10 already says this for Create label (put the action where it becomes relevant) and P15 limits the accent to the primary action, so this is mostly a failure to apply. The candidate addition is an explicit anti-pattern for the same action repeated per group.",
  "classification": {
    "status": "proposed",
    "kind": "guidance-ambiguity",
    "rationale": "Covered in spirit by P10 and P15 (failure to apply), but there is no anti-pattern naming it. Suggestion: new anti-pattern candidate; owner decides if the existing text is enough. Confirmation needed.",
    "proposedBy": "claude-agent"
  },
  "relatedPrinciples": [
    "P10",
    "P15",
    "P09"
  ],
  "relatedAntiPatterns": [],
  "status": "proposal-drafted",
  "proposal": "PR-0002"
}
